Title,Creator,Date,Description,Subject,Format,Identifier,Source,Rights,Language
"The American Labor Movement: A Short History","U.S. Department of Labor",1976-01-01,"A historical overview of the American labor movement published by the U.S. Department of Labor covering major milestones from the 19th century through the mid-20th century.","labor history; unions; workers rights; American history",PDF,https://archive.org/details/americanlabormovement1976,Internet Archive,Public Domain,English
"Student Nonviolent Coordinating Committee (SNCC) Records","Student Nonviolent Coordinating Committee",1959-01-01,"Digitized records and publications from the SNCC including newsletters, meeting minutes, and organizational documents from the civil rights era.","civil rights; student activism; SNCC; social movements; university activism",PDF,https://archive.org/details/sncc-records,Internet Archive,Public Domain,English
"Industrial Workers of the World: Proceedings of the First Convention","Industrial Workers of the World",1905-06-27,"Full proceedings of the founding convention of the Industrial Workers of the World held in Chicago in June 1905, including speeches and founding documents.","labor unions; IWW; Wobblies; labor organizing; workers rights",PDF,https://archive.org/details/iww-founding-convention-1905,Internet Archive,Public Domain,English
"Free Speech Movement: UC Berkeley 1964","Bancroft Library — UC Berkeley",1964-01-01,"Collection of documents, photographs, and primary sources related to the Free Speech Movement at UC Berkeley in 1964, one of the landmark student activism events in American history.","student activism; free speech; UC Berkeley; university protests; 1960s",Mixed,https://archive.org/details/free-speech-movement-berkeley,Internet Archive,Public Domain,English
"Women in Industry: A Study in American Economic History","Edith Abbott",1910-01-01,"A comprehensive early study on the role of women in American industry and the labor force, documenting working conditions and wages in the early 20th century.","women; labor; industry; economic history; gender and work",PDF,https://archive.org/details/womeninindustry00abborich,Internet Archive,Public Domain,English
